71,2009,Energía,Eveready de Colombia S.A.,N/A,"35, 36, 9",N/A,Prensa,N/A,"Honestidad, Leal competencia, Principio de veracidad",Empresa/competidor,Cesación temporal,"Procter & Gamble Colombia Ltda. reclamó contra Eveready de Colombia S.A. por un anuncio publicitario de pilas Energizer Lithium, alegando publicidad comparativa inapropiada y despectiva hacia sus productos Duracell. El anuncio afirmaba que las pilas Energizer Lithium duran seis veces más que las pilas Duracell comunes en cámaras digitales y representaba visualmente esta afirmación mostrando una pila Energizer tumbando seis conejos rosados con el logo de Duracell.",Procter & Gamble de Colombia S.A.,Multinacional
72,2009,Belleza e Higiene,Beiersdorf S.A.,N/A,"13, 15, 16, 7",N/A,"Internet, Medios gráficos, Radio, Televisión, Varios",Otras CONARP,"Honestidad, Leal competencia, Principio de veracidad",Empresa/competidor,Desestimado,"Unilever Andina Colombia Ltda. reclamó contra Beiersdorf S.A. (BDF), por publicidad del desodorante Nivea Double Effect. Unilever argumentó que las afirmaciones del anuncio eran engañosas y no estaban soportadas por pruebas científicas adecuadas, sugiriendo que el producto no proporcionaba los beneficios prometidos de afeitadas más a ras y menos frecuentes. Beiersdorf defendió la veracidad de su publicidad, argumentando que estaba basada en estudios científicos y que el anuncio no violaba las normas éticas. La CONARP finalmente determinó que las afirmaciones estaban debidamente comprobadas y desestimó la reclamación.",Unilever Andina Colombia Ltda.,Multinacional
73,2009,Belleza e Higiene,"Agencia de Publicidad Leo Burnett, Procter & Gamble S.A.",N/A,"15, 21, 29, 31, 7, 8, 9",N/A,Televisión,N/A,"Honestidad, Leal competencia, Principio de veracidad",Empresa/competidor,Desestimado,"Unilever Andina Colombia Ltda. denunció a Procter & Gamble Colombia Ltda. y a la Agencia de Publicidad Leo Burnett por la campaña publicitaria del shampoo anticaspa Head & Shoulders, alegando imitación de elementos de su campaña para el shampoo CLEAR y confusión en el mercado. Unilever argumentó que P&G usó elementos visuales y textuales similares a los de su campaña de expectativa, confundiendo a los consumidores y desvirtuando el impacto de su lanzamiento. Procter & Gamble defendió la originalidad de su campaña y negó las acusaciones, justificando la veracidad de sus afirmaciones con datos de estudios de mercado. La CONARP determinó que no hubo violación de las normas éticas y que los elementos utilizados por P&G no constituían una imitación indebida.",Unilever Andina Colombia Ltda.,Multinacional
74,2009,Alimentación,Tecnología Empresarial de Alimentos - TEAM S.A.,N/A,"13, 2, 33, 7, 9",N/A,Televisión,General,"Honestidad, Leal competencia, Principio de veracidad",Empresa/competidor,"Cesación temporal, Rectificación","La empresa Fábrica de Grasas y Productos Químicos - GRASCO LTDA denunció a Tecnología Empresarial de Alimentos - TEAM S.A por la publicidad de una nueva margarina, argumentando que el empaque y las características mostradas en los anuncios de televisión eran confusamente similares a los de su producto ""Margarina La Fina"", induciendo a error al consumidor sobre la calidad y características del producto de GRASCO. GRASCO solicitó la suspensión de la publicidad y afirmó que el comercial sugería erróneamente que su margarina se quemaba fácilmente, lo cual es una característica común de todas las margarinas si no se manejan adecuadamente.",Fábrica de Grasas y Productos Químicos - GRASCO LTDA.,Nacional
76,2009,Salud,"Genomma Lab Colombia Ltda, Genomma Lab International S.A.B de C.V.",N/A,"15, 16, 2, 28, 29, 3, 4, 5, 57, 7, 8, 9",Estatuto del Consumidor,Varios,General,Principio de veracidad,Empresa/competidor,"Desestimado parcial, Informa contravención, Traslado a autoridad compentente","El Sr. Carrero Parra, actuando como consumidor y abogado, denuncia a Genomma Lab por uso indebido de marcas no registradas como ASEPXIA, SILK y SILKA, alegando que se publicitan como registradas cuando aún están en trámite o han sido negadas.",Javier Fernando Carrero Parra,Nacional
77,2010,Belleza e Higiene,Colgate Palmolive,N/A,"13, 15, 16, 18, 36b, 7, 9",N/A,"Empaque, Marketing Directo, Varios",General,"Buena fe del consumidor, Leal competencia, Principio de veracidad",Empresa/competidor,"Desestimado parcial, Rectificación","Procter & Gamble Colombia Ltda. denunció a Colgate Palmolive Compañía por publicidad engañosa de sus pastas dentales Colgate Total 12, alegando que prometen beneficios no comprobables. La CONARP dictaminó la rectificación de ciertos términos publicitarios utilizados por Colgate.",Procter & Gamble de Colombia S.A.,Multinacional
78,2011,Salud,Boehringer Ingelheim S.A.,"Corte Constitucional de Colombia, Superintendencia de industria y comercio","29, 31",N/A,Varios,Concepto 73,"Buena fe del consumidor, Leal competencia",Empresa/competidor,"Cesación definitiva, Decisión inhibitoria","Reckitt Benckiser Inc. denunció a Boehringer Ingelheim S.A. por el uso del personaje ""Mucus Monster"" en su publicidad, alegando que imitaba su personaje ""Mr. Mucus Character"" usado anteriormente a nivel mundial. Reckitt solicitó el cese del uso de Mucus Monster y la retirada de las solicitudes de registro de marca. Boehringer defendió su uso del personaje, argumentando que había utilizado un concepto similar desde antes que Reckitt y en otros mercados internacionales. CONARP concluyó que Boehringer utilizó el concepto primero y recomendó que Reckitt no utilizara su personaje en Colombia.",Reckitt Benckiser Inc.,Multinacional
79,2011,Alimentación,Masterfoods Colombia Ltda.,"Académia, CONAR México, Declaración Universal de los Derechos Humanos","10, 11, 2",Ley 1257 de 2008,Televisión,General,"Dignidad de las personas, No discriminación",Particulares,Cesación definitiva,"Dora Cecilia Saldarriaga Grisales y Janeleene Melissa López Cely, ambas consumidoras, presentaron quejas sobre un comercial de Snickers que consideraron discriminatorio hacia las mujeres. El comercial sugería estereotipos de género despectivos. La CONARP de Colombia, después de recibir el caso de varias instituciones, incluido el Ministerio de Tecnologías de la Información y las Comunicaciones, concluyó que el anuncio violaba los principios de dignidad y no discriminación y recomendó que su difusión fuera interrumpida.","Dora Cecilia Saldarriaga Grisales, Janeleene Melissa López Cely",Multinacional
80,2011,Limpieza,Reckitt Benckiser Colombia S.A.,Consejo de Estado de Colombia,"15, 16, 18, 7, 9",N/A,Televisión,N/A,"Honestidad, Principio de veracidad",Empresa/competidor,"Cesación temporal, Rectificación","BRINSA S.A. denunció a RECKITT BENCKISER COLOMBIA S.A. por la publicidad de su producto ""Vanish Extra Higiene,"" alegando que las afirmaciones del comercial eran falsas y engañosas. Argumentaron que no era el único producto con oxígeno y partículas desinfectantes como se afirmaba y que tal declaración no era comprobable. RECKITT defendió su anuncio, pero la CONARP determinó que el uso de ""único"" era inapropiado y ordenó la suspensión del anuncio hasta que las correcciones necesarias fueran hechas.",Brinsa S.A.,Multinacional
83,2012,Belleza e Higiene,Procter & Gamble S.A.,N/A,"13, 15, 16, 18, 34, 36, 7, 9",N/A,Varios,"Concepto 64, Concepto 77","Leal competencia, Principio de veracidad, Publicidad comparativa",Empresa/competidor,"Amonestación, Cesación temporal, Rectificación","Colgate Palmolive Compañía presentó una reclamación contra Procter & Gamble Colombia por un anuncio comparativo del producto Oral B Pro Salud Limpieza Profunda, alegando que el anuncio infringía múltiples artículos del Código Colombiano de Autorregulación Publicitaria por presentar afirmaciones engañosas de superioridad y omitir información relevante sobre Colgate Total 12. La CONARP sugirió la modificación del anuncio para evitar el engaño y la suspensión temporal de su difusión.",Colgate Palmolive,Multinacional
84,2012,Belleza e Higiene,Colgate Palmolive,N/A,"13, 15, 16, 17, 18, 34, 36, 7, 8, 9",N/A,Varios,"Concepto 66 de 2007, Concepto 77","Honestidad, Leal competencia, Principio de veracidad, Publicidad comparativa",Empresa/competidor,"Cesación temporal, Desestimado parcial, Orden de cumplimiento","Procter & Gamble Colombia (solicitante) denunció a Colgate Palmolive Compañía (denunciado) ante la Comisión Nacional de Autorregulación Publicitaria (CONARP) por prácticas publicitarias consideradas engañosas en la campaña de las pastas dentales Colgate Total 12. Procter & Gamble argumentó que Colgate infringió múltiples artículos del Código Colombiano de Autorregulación Publicitaria (CCAP), haciendo afirmaciones inverificables y engañosas sobre la exclusividad y beneficios de su producto.",Procter & Gamble de Colombia S.A.,Multinacional
85,2013,Belleza e Higiene,Procter & Gamble S.A.,N/A,"15, 16, 17, 18, 34, 36, 7, 9",N/A,Varios,Concepto 56,"Leal competencia, Principio de veracidad, Publicidad comparativa",Empresa/competidor,"Cesación temporal, Rectificación",Colgate Palmolive Compañía (solicitante) presentó una denuncia contra Procter & Gamble Colombia (denunciado) en relación con el comercial comparativo entre las pastas dentales Oral B Pro-Salud Whitening y Colgate Luminous White. Colgate argumentó que el anuncio incluía afirmaciones engañosas sobre los beneficios de salud bucal y solicitó su retiro y corrección.,Colgate Palmolive,Multinacional
86,2013,Belleza e Higiene,Procter & Gamble S.A.,N/A,"13, 15, 16, 18, 34, 36, 7, 9",N/A,Varios,N/A,"Buena fe del consumidor, Honestidad, Leal competencia, Principio de veracidad, Publicidad comparativa",Empresa/competidor,"Cesación temporal, Orden de cumplimiento","Colgate Palmolive Compañía (reclamante) denunció a Procter & Gamble Colombia (denunciado) ante la CONARP, alegando que el comercial de Oral B Complete Limpieza Profunda cometía publicidad engañosa al afirmar una superioridad en limpieza que no estaba debidamente soportada por pruebas científicas, y que denigraba su producto Colgate Triple Acción.",Colgate Palmolive,Multinacional